{
  "contract": "pocketfinancer.reason-code-registry/3",
  "predecessor": "pocketfinancer.reason-code-registry/2",
  "legacy_meanings_frozen": true,
  "unknown_safety_code_policy": "retain_review",
  "namespaces": [
    {
      "namespace": "analysis",
      "stage": "analysis",
      "codes": [
        {
          "code": "invalid_input",
          "meaning": "The admitted source cannot be analyzed as a nonempty message.",
          "severity": "terminal",
          "safety_relevant": true,
          "allowed_outcomes": [
            "discard"
          ],
          "user_message": "The admitted source cannot be analyzed as a nonempty message."
        },
        {
          "code": "reliable_outgoing_metadata",
          "meaning": "Authoritative acquisition metadata identifies an outgoing message.",
          "severity": "terminal",
          "safety_relevant": true,
          "allowed_outcomes": [
            "discard"
          ],
          "user_message": "Authoritative acquisition metadata identifies an outgoing message."
        },
        {
          "code": "non_posted_failure",
          "meaning": "Source evidence states that a movement failed or was declined.",
          "severity": "review",
          "safety_relevant": true,
          "allowed_outcomes": [
            "discard",
            "retain_review"
          ],
          "user_message": "Source evidence states that a movement failed or was declined."
        },
        {
          "code": "negated_movement",
          "meaning": "Source evidence explicitly negates a financial movement.",
          "severity": "review",
          "safety_relevant": true,
          "allowed_outcomes": [
            "discard",
            "retain_review"
          ],
          "user_message": "Source evidence explicitly negates a financial movement."
        },
        {
          "code": "pending_event",
          "meaning": "Source evidence describes a pending or future movement.",
          "severity": "review",
          "safety_relevant": true,
          "allowed_outcomes": [
            "retain_review"
          ],
          "user_message": "Source evidence describes a pending or future movement."
        },
        {
          "code": "amount_due",
          "meaning": "Source evidence describes an amount due rather than a completed movement.",
          "severity": "review",
          "safety_relevant": true,
          "allowed_outcomes": [
            "discard",
            "retain_review"
          ],
          "user_message": "Source evidence describes an amount due rather than a completed movement."
        },
        {
          "code": "request_or_authorization",
          "meaning": "Source evidence requests approval or authorization.",
          "severity": "review",
          "safety_relevant": true,
          "allowed_outcomes": [
            "discard",
            "retain_review"
          ],
          "user_message": "Source evidence requests approval or authorization."
        },
        {
          "code": "expected_refund_not_posted",
          "meaning": "A refund or reversal is expected, anticipated, promised, or future.",
          "severity": "review",
          "safety_relevant": true,
          "allowed_outcomes": [
            "retain_review",
            "not_posted"
          ],
          "user_message": "A refund or reversal is expected, anticipated, promised, or future."
        },
        {
          "code": "authorization_or_hold_not_posted",
          "meaning": "An amount is merely authorized, preauthorized, or held.",
          "severity": "review",
          "safety_relevant": true,
          "allowed_outcomes": [
            "retain_review",
            "not_posted"
          ],
          "user_message": "An amount is merely authorized, preauthorized, or held."
        },
        {
          "code": "credential_otp",
          "meaning": "The source contains credential or one-time-password evidence.",
          "severity": "review",
          "safety_relevant": true,
          "allowed_outcomes": [
            "discard",
            "retain_review",
            "invoke"
          ],
          "user_message": "The source contains credential or one-time-password evidence."
        },
        {
          "code": "balance_information",
          "meaning": "The source contains balance information.",
          "severity": "info",
          "safety_relevant": false,
          "allowed_outcomes": [
            "observe",
            "discard",
            "invoke"
          ],
          "user_message": "The source contains balance information."
        },
        {
          "code": "promotion",
          "meaning": "The source contains promotional language.",
          "severity": "info",
          "safety_relevant": false,
          "allowed_outcomes": [
            "observe",
            "discard",
            "retain_review"
          ],
          "user_message": "The source contains promotional language."
        },
        {
          "code": "administrative",
          "meaning": "The source contains administrative account language.",
          "severity": "info",
          "safety_relevant": false,
          "allowed_outcomes": [
            "observe",
            "discard",
            "retain_review"
          ],
          "user_message": "The source contains administrative account language."
        },
        {
          "code": "ambiguous_currency_marker",
          "meaning": "A globally ambiguous currency marker cannot be resolved safely.",
          "severity": "review",
          "safety_relevant": true,
          "allowed_outcomes": [
            "retain_review"
          ],
          "user_message": "A globally ambiguous currency marker cannot be resolved safely."
        },
        {
          "code": "unsupported_currency_code",
          "meaning": "The source names a valid but unsupported ISO currency.",
          "severity": "review",
          "safety_relevant": true,
          "allowed_outcomes": [
            "retain_review"
          ],
          "user_message": "The source names a valid but unsupported ISO currency."
        },
        {
          "code": "conflicting_currencies",
          "meaning": "The analysis contains more than one normalized currency.",
          "severity": "review",
          "safety_relevant": true,
          "allowed_outcomes": [
            "retain_review"
          ],
          "user_message": "The analysis contains more than one normalized currency."
        },
        {
          "code": "amount_candidate_present",
          "meaning": "At least one exact source-backed amount candidate exists.",
          "severity": "info",
          "safety_relevant": false,
          "allowed_outcomes": [
            "observe",
            "invoke",
            "retain_review"
          ],
          "user_message": "At least one exact source-backed amount candidate exists."
        },
        {
          "code": "completed_direction_candidate_present",
          "meaning": "At least one completed source-backed direction candidate exists.",
          "severity": "info",
          "safety_relevant": false,
          "allowed_outcomes": [
            "observe",
            "invoke",
            "retain_review"
          ],
          "user_message": "At least one completed source-backed direction candidate exists."
        },
        {
          "code": "rail_upi",
          "meaning": "The source contains UPI rail evidence.",
          "severity": "info",
          "safety_relevant": false,
          "allowed_outcomes": [
            "observe",
            "invoke",
            "retain_review"
          ],
          "user_message": "The source contains UPI rail evidence."
        },
        {
          "code": "rail_imps",
          "meaning": "The source contains IMPS rail evidence.",
          "severity": "info",
          "safety_relevant": false,
          "allowed_outcomes": [
            "observe",
            "invoke",
            "retain_review"
          ],
          "user_message": "The source contains IMPS rail evidence."
        },
        {
          "code": "rail_neft",
          "meaning": "The source contains NEFT rail evidence.",
          "severity": "info",
          "safety_relevant": false,
          "allowed_outcomes": [
            "observe",
            "invoke",
            "retain_review"
          ],
          "user_message": "The source contains NEFT rail evidence."
        },
        {
          "code": "rail_rtgs",
          "meaning": "The source contains RTGS rail evidence.",
          "severity": "info",
          "safety_relevant": false,
          "allowed_outcomes": [
            "observe",
            "invoke",
            "retain_review"
          ],
          "user_message": "The source contains RTGS rail evidence."
        },
        {
          "code": "rail_nach",
          "meaning": "The source contains NACH rail evidence.",
          "severity": "info",
          "safety_relevant": false,
          "allowed_outcomes": [
            "observe",
            "invoke",
            "retain_review"
          ],
          "user_message": "The source contains NACH rail evidence."
        }
      ]
    },
    {
      "namespace": "triage",
      "stage": "triage",
      "codes": [
        {
          "code": "discard_invalid_input",
          "meaning": "Invalid input is terminally discarded after admission policy permits erasure.",
          "severity": "terminal",
          "safety_relevant": true,
          "allowed_outcomes": [
            "discard"
          ],
          "user_message": "Invalid input is terminally discarded after admission policy permits erasure."
        },
        {
          "code": "discard_reliable_outgoing",
          "meaning": "Authoritatively outgoing evidence is terminally discarded.",
          "severity": "terminal",
          "safety_relevant": true,
          "allowed_outcomes": [
            "discard"